<?xml version="1.0" encoding="UTF-8"?>
<xs:schema xmlns:xs="http://www.w3.org/2001/XMLSchema" targetNamespace="http://www.example.com/person" xmlns="http://www.example.com/person" elementFormDefault="qualified">

  <!-- Root element -->
  <xs:element name="person">
    <xs:complexType>
      <xs:sequence>
        
        <!-- Personal Info -->
        <xs:element name="personalInfo">
          <xs:complexType>
            <xs:sequence>
              <xs:element name="name" type="xs:string"/>
              <xs:element name="email">
                <xs:simpleType>
                  <xs:restriction base="xs:string">
                    <xs:pattern value="[a-zA-Z0-9._%+-]+@[a-zA-Z0-9.-]+\.[a-zA-Z]{2,}"/>
                  </xs:restriction>
                </xs:simpleType>
              </xs:element>
              <xs:element name="address">
                <xs:complexType>
                  <xs:sequence>
                    <xs:element name="houseNumber" type="xs:string"/>
                    <xs:element name="city" type="xs:string"/>
                    <xs:element name="pincode" type="xs:string"/>
                  </xs:sequence>
                </xs:complexType>
              </xs:element>
            </xs:sequence>
          </xs:complexType>
        </xs:element>
        
        <!-- Household -->
        <xs:element name="household">
          <xs:complexType>
            <xs:sequence>
              <xs:element name="children">
                <xs:complexType>
                  <xs:sequence>
                    <xs:element name="child" maxOccurs="unbounded">
                      <xs:complexType>
                        <xs:attribute name="name" type="xs:string" use="required"/>
                      </xs:complexType>
                    </xs:element>
                  </xs:sequence>
                </xs:complexType>
              </xs:element>
              <xs:element name="married">
                <xs:simpleType>
                  <xs:restriction base="xs:string">
                    <xs:enumeration value="yes"/>
                    <xs:enumeration value="no"/>
                  </xs:restriction>
                </xs:simpleType>
              </xs:element>
              <xs:element name="partner">
                <xs:complexType>
                  <xs:attribute name="name" type="xs:string" use="required"/>
                  <xs:attribute name="age" type="xs:integer" use="required"/>
                </xs:complexType>
              </xs:element>
            </xs:sequence>
          </xs:complexType>
        </xs:element>
        
      </xs:sequence>
    </xs:complexType>
  </xs:element>

</xs:schema>
